{
  "schema_version": 3,
  "goal": {
    "version": 1,
    "expr": {
      "op": "count",
      "filter": {
        "codes": [],
        "locations": []
      },
      "min": 0
    },
    "continuation_steps": 4,
    "max_aux_candidates": 8,
    "gain_order": []
  },
  "knowledge_id": null,
  "max_proposals": 1,
  "max_steps": 32,
  "analysis": {
    "deck": {
      "main": [
        25538345,
        25538345,
        25538345,
        36426778,
        36426778,
        36426778,
        90432163,
        90432163,
        90432163,
        63821877,
        63821877,
        63821877,
        88544390,
        88544390,
        88544390,
        98827725,
        98827725,
        98827725,
        25542642,
        25542642,
        25542642,
        32807846,
        81439173,
        2964201,
        2964201,
        2964201,
        2971090,
        2971090,
        2971090,
        3797883,
        3797883,
        3797883,
        4035199,
        4035199,
        4035199,
        4179849,
        4179849,
        4179849,
        4392470,
        4392470
      ],
      "extra": [
        58699500,
        26692769,
        62709239
      ],
      "side": []
    },
    "opening_hand": [
      25538345,
      36426778,
      2964201,
      2964201,
      2971090
    ],
    "seed": 1,
    "rules": "ocg-mr5",
    "banlist_id": "latest-ocg",
    "as_of": "2026-10-01",
    "search": {
      "top_k": 5,
      "node_budget": 512,
      "beam_width": 32,
      "max_depth": 128,
      "time_limit_ms": 120000
    }
  }
}
