{
  "schema_version": 3,
  "goal": {
    "version": 1,
    "expr": {
      "op": "all",
      "args": [
        {
          "op": "count",
          "filter": {
            "codes": [
              58699500
            ],
            "locations": [
              4
            ],
            "position_mask": 5
          },
          "min": 1
        },
        {
          "op": "count",
          "filter": {
            "codes": [
              25542642
            ],
            "locations": [
              8
            ],
            "position_mask": 10
          },
          "min": 1
        },
        {
          "op": "count",
          "filter": {
            "codes": [
              90432163
            ],
            "locations": [
              16
            ]
          },
          "min": 1
        },
        {
          "op": "available",
          "effect_id": "90432163:search",
          "filter": {
            "codes": [
              90432163
            ],
            "locations": [
              16
            ]
          },
          "window": "main_end"
        },
        {
          "op": "continuation",
          "goal": {
            "op": "count",
            "filter": {
              "codes": [
                90432163
              ],
              "locations": [
                32
              ]
            },
            "min": 1
          },
          "gains": [
            {
              "id": "boots",
              "filter": {
                "codes": [
                  36426778
                ],
                "locations": [
                  2
                ]
              },
              "min_delta": 1
            },
            {
              "id": "scales",
              "filter": {
                "codes": [
                  25538345
                ],
                "locations": [
                  2
                ]
              },
              "min_delta": 1
            }
          ],
          "max_steps": 1
        }
      ]
    },
    "continuation_steps": 4,
    "max_aux_candidates": 8,
    "gain_order": [
      "boots",
      "scales"
    ]
  },
  "knowledge_id": null,
  "max_proposals": 8,
  "max_steps": 32,
  "analysis": {
    "deck": {
      "main": [
        25538345,
        25538345,
        25538345,
        36426778,
        36426778,
        36426778,
        90432163,
        90432163,
        90432163,
        63821877,
        63821877,
        63821877,
        88544390,
        88544390,
        88544390,
        98827725,
        98827725,
        98827725,
        25542642,
        25542642,
        25542642,
        32807846,
        81439173,
        2964201,
        2964201,
        2964201,
        2971090,
        2971090,
        2971090,
        3797883,
        3797883,
        3797883,
        4035199,
        4035199,
        4035199,
        4179849,
        4179849,
        4179849,
        4392470,
        4392470
      ],
      "extra": [
        58699500,
        26692769,
        62709239
      ],
      "side": []
    },
    "opening_hand": [
      25538345,
      36426778,
      2964201,
      2964201,
      2971090
    ],
    "seed": 1,
    "rules": "ocg-mr5",
    "banlist_id": "latest-ocg",
    "as_of": "2026-10-01",
    "search": {
      "top_k": 5,
      "node_budget": 512,
      "beam_width": 32,
      "max_depth": 128,
      "time_limit_ms": 120000
    }
  }
}
