{
  "schema_version": 3,
  "goal": {
    "version": 1,
    "expr": {
      "op": "all",
      "args": [
        {
          "op": "count",
          "filter": {
            "codes": [
              32807846
            ],
            "locations": [
              2
            ]
          },
          "min": 1
        },
        {
          "op": "not",
          "arg": {
            "op": "available",
            "effect_id": "32807846:search",
            "filter": {
              "codes": [
                32807846
              ],
              "locations": [
                2
              ]
            },
            "window": "main_end"
          }
        }
      ]
    },
    "continuation_steps": 4,
    "max_aux_candidates": 8,
    "gain_order": []
  },
  "knowledge_id": null,
  "max_proposals": 1,
  "max_steps": 32,
  "analysis": {
    "deck": {
      "main": [
        25542642,
        2964201,
        2964201,
        2964201,
        2971090,
        2971090,
        2971090,
        3797883,
        3797883,
        3797883,
        4035199,
        4035199,
        4035199,
        4179849,
        4179849,
        4179849,
        4392470,
        4392470,
        4392470,
        6368038,
        6368038,
        6368038,
        6631034,
        6631034,
        6631034,
        6740720,
        6740720,
        6740720,
        7562372,
        7562372,
        7562372,
        8353769,
        8353769,
        8353769,
        9540040,
        9540040,
        9540040,
        32807846,
        25542642,
        25542642
      ],
      "extra": [
        58699500,
        26692769,
        62709239
      ],
      "side": []
    },
    "opening_hand": [
      32807846,
      2964201,
      2964201,
      2971090,
      2971090
    ],
    "seed": 1,
    "rules": "ocg-mr5",
    "banlist_id": "latest-ocg",
    "as_of": "2026-10-01",
    "search": {
      "top_k": 5,
      "node_budget": 512,
      "beam_width": 32,
      "max_depth": 128,
      "time_limit_ms": 120000
    }
  }
}
